{"$schema":"https://json-schema.org/draft/2020-12/schema","title":"SupplyChainRecord","type":"object","required":["id","record_type","attributes","source"],"properties":{"id":{"type":"string"},"record_type":{"type":"string"},"status":{"type":["string","null"]},"partner_id":{"type":["string","null"]},"occurred_at":{"type":["string","null"],"format":"date-time"},"attributes":{"type":"object","additionalProperties":true},"source":{"type":"object","required":["source_system","observed_at"],"properties":{"source_system":{"type":"string"},"observed_at":{"type":"string","format":"date-time"},"freshness_score":{"type":["number","null"],"minimum":0,"maximum":1},"confidence_score":{"type":["number","null"],"minimum":0,"maximum":1}}}},"additionalProperties":false}
